"9","may stop you from gaining access to a Service or limit the features that you can use.","Dont use service/feature"
"9","You can choose not to provide us with certain information, but this may stop you from gaining access to a Service or limit the features that you can use. For more information, please see the How We Use Your Information section below.","Opt-in"
"9","You can choose not to provide us with certain information, but this may stop you from gaining access to a Service or limit the features that you can use. For more information, please see the How We Use Your Information section below.","Dont use service/feature"
"14","delete","Browser/device privacy controls"
"14","You can limit the way that we tailor advertising based on your self-reported interests and other information in your profile by clicking on the ""Profile"" or ""My Account"" section of this Site and deleting or modifying the information.","Other"
"14","ou can limit the way that we tailor advertising based on your self-reported interests and other information in your profile by clicking on the ""Profile"" or ""My Account"" section of this Site and","First-party privacy controls"
"17","removed by following your Internet browser's","Browser/device privacy controls"
"17","If you choose to disable cookies, some aspects of the Sites may not work properly, and you may not be able to access our Services","Dont use service/feature"
"17","Cookies can be removed by following your Internet browser's directions within the help tab.","Browser/device privacy controls"
"17","Cookies can be removed by following your Internet browser's directions within the help tab","Browser/device privacy controls"
"22","opting-out of cookies placed by those vendors listed.","Opt-out link"
"22","We do adhere to the Self-Regulatory Principles for Online Behavioral Advertising of the Digital Advertising Alliance (for more information click here).","Third-party privacy controls"
"22","You can choose to limit Behavioral Advertising on the Sites by clicking here and opting-out of cookies placed by those vendors listed.","Third-party privacy controls"
"22","You can choose to limit Behavioral Advertising on the Sites by clicking here and opting-out of cookies placed by those vendors listed.","Third-party privacy controls"
"22","You can choose to limit Behavioral Advertising on the Sites by clicking here and opting-out of cookies placed by those vendors listed.","Third-party privacy controls"
"22","You can choose to limit Behavioral Advertising on the Sites by clicking here and opting-out of cookies placed by those vendors listed.","Opt-out link"
"23","Network Advertising Initiative (NAI) and/or the Digital Advertising Alliance (DAA) and abide by NAI and/or DAA principles. If you wish to opt out of participating in advertising programs conducted by NAI and DAA members or learn more about the NAI and DAA, please go to the NAI Opt-Out website and DAA Choice Page and follow the instructions. After you opt-out, you will still see advertisements, but the advertising may not be as relevant to your interests. If you change your computer, change your browser or delete your cookies, you will need to renew your opt-out.","Third-party privacy controls"
"23","Network Advertising Initiative (NAI) and/or the Digital Advertising Alliance (DAA) and abide by NAI and/or DAA principles. If you wish to opt out of participating in advertising programs conducted by NAI and DAA members or learn more about the NAI and DAA, please go to the NAI Opt-Out website and DAA Choice Page and follow the instructions. After you opt-out, you will still see advertisements, but the advertising may not be as relevant to your interests. If you change your computer, change your browser or delete your cookies, you will need to renew your opt-out.","Third-party privacy controls"
"23","please go to the NAI Opt-Out website and DAA Choice Page and follow the instructions","Third-party privacy controls"
"23","Many third party vendors that engage in Behavioral Advertising participate in the Network Advertising Initiative (NAI) and/or the Digital Advertising Alliance (DAA) and abide by NAI and/or DAA principles. If you wish to opt out of participating in advertising programs conducted by NAI and DAA members or learn more about the NAI and DAA, please go to the NAI Opt-Out website and DAA Choice Page and follow the instructions. After you opt-out, you will still see advertisements, but the advertising may not be as relevant to your interests. If you change your computer, change your browser or delete your cookies, you will need to renew your opt-out.","Third-party privacy controls"
"23","Many third party vendors that engage in Behavioral Advertising participate in the Network Advertising Initiative (NAI) and/or the Digital Advertising Alliance (DAA) and abide by NAI and/or DAA principles. If you wish to opt out of participating in advertising programs conducted by NAI and DAA members or learn more about the NAI and DAA, please go to the NAI Opt-Out website and DAA Choice Page and follow the instructions. After you opt-out, you will still see advertisements, but the advertising may not be as relevant to your interests. If you change your computer, change your browser or delete your cookies, you will need to renew your opt-out.","Third-party privacy controls"
"24","f you do not want us to use or disclose Personal Information collected about you in the ways identified in this Policy, you should not use the Site or Services.","Dont use service/feature"
"24","If you do not want us to use or disclose Personal Information collected about you in the ways identified in this Policy, you should not use the Site or Services.","Dont use service/feature"
"24","If you do not want us to use or disclose Personal Information collected about you in the ways identified in this Policy, you should not use the Site or Services.","Dont use service/feature"
"24","If you do not want us to use or disclose Personal Information collected about you in the ways identified in this Policy, you should not use the Site or Services.","Dont use service/feature"
"24","If you do not want us to use or disclose Personal Information collected about you in the ways identified in this Policy, you should not use the Site or Services.","Dont use service/feature"
"24","If you do not want us to use or disclose Personal Information collected about you in the ways identified in this Policy, you should not use the Site or Services.","Dont use service/feature"
"31","you give us permission at the time of collection","Opt-in"
"31","extent that you give us permission at the time of collection","Opt-in"
"31","extent that you give us permission at the time of collection","Opt-in"
"35","opt-out""","Opt-out link"
"35","opt-out""","Opt-out link"
"35","When you receive promotional communications from us you will have the opportunity to ""opt-out"" by following the unsubscribe instructions provided in the promotional e-mail or newsletter you receive","Opt-out link"
"35","by editing your preference to receive these communications within the ""Manage My Email"" or similar feature on the individual Sites when you are logged in as a registered user","First-party privacy controls"
"35","ewsletter you receive or by editing your preference to receive these communications within the ""Manage My Email"" or similar feature on the individual Sites when you are logged in as a registered user","First-party privacy controls"
