"6","However, we only save the most recent version of comments and posts, so your previous edits, once overwritten, are no longer available.","Edit information"
"31","delete your reddit account at any time.","Delete account (partial)"
"31","You may choose to delete your reddit account at any time. The usernames associated with deleted accounts remain unavailable for others to use, and your public profile is no longer visible to reddit users. However, the posts and content you made during your tenure as a reddit user will not be automatically deleted as part of the account removal process,","Delete account (partial)"
"31","However, the posts and content you made during your tenure as a reddit user will not be automatically deleted as part of the account removal process, though your username will be publicly disassociated with all posts.","Delete account (partial)"
"31","You may choose to delete your reddit account at any time. The usernames associated with deleted accounts remain unavailable for others to use, and your public profile is no longer visible to reddit users. However, the posts and content you made during your tenure as a reddit user will not be automatically deleted as part of the account removal process, though your username will be publicly disassociated with all posts.","Delete account (partial)"
"40","If you believe that someone has submitted, without your permission, to reddit a link to a photograph, video, or digital image of you in a state of nudity or engaged in any act of sexual conduct, please contact us ( contact@reddit.com), and we will expedite its removal as quickly as possible.","Other"
"49","delete","Delete account (partial)"
"49","If you delete a reddit app from your mobile device, any app-specific information stored on your device will be deleted from your device. If you have backed up your devices apps, reddit app information may continue to exist where you have backed it up.","Delete account (partial)"
"49","If you delete a reddit app from your mobile device, any app-specific information stored on your device will be deleted from your device.","Other"
