"23","You may have access to, review, correct, update, change or delete your account profile information at any time. Simply log into your account, go to your profile, and make the necessary changes.","Delete account (partial)"
"23","You may have access to, review,","View"
"23","correct, update, change","Edit information"
"23","delete your account profile information at any time.","Other"
"24","If you wish to delete or close your account or account profile information altogether, please click here for more information on how to contact us. We will retain logs, demographic, indirect, and statistical information about you and keep an archival copy of this information in an anonymized form.","Delete account (full)"
"23","You may have access to, review,","View"
"23","correct, update, change","Edit information"
"23","or delete","Delete account (partial)"
"24","If you wish to delete or close your account or account profile information altogether","Delete account (full)"
