"18","update","Edit information"
"18","update","Edit information"
"18","delete","Delete account (partial)"
"18","You may update or delete your personal information or modify your account preferences for the Curse Features by accessing the ""My Account"" area of the Curse Features or sending us an email to support@curse.com requesting us to update or delete your personal information.","Edit information"
"18","You may update or delete your personal information or modify your account preferences for the Curse Features by accessing the ""My Account"" area of the Curse Features or sending us an email to support@curse.com requesting us to update or delete your personal information.","Delete account (partial)"
"18","update or delete y","Edit information"
