"1","the security approaches we use to protect your information.","Generic"
"10","We do not store or otherwise share any such credit card information.","Generic"
"15","may have access to such information and agree to keep this information confidential.","Data access limitation"
"22","follows generally accepted industry security standards to safeguard and help prevent unauthorized access, maintain data security and correctly use personal information","Generic"
"22","The Post-Gazette follows generally accepted industry security standards to safeguard and help prevent unauthorized access, maintain data security and correctly use personal information. However, no commercial method of information transfer over the Internet or electronic data storage is known to be 100% secure. As a result, we cannot guarantee the absolute security of that information during its transmission or its storage in our systems.","Generic"
"22","The Post-Gazette follows generally accepted industry security standards to safeguard and help prevent unauthorized access, maintain data security and correctly use personal information. However, no commercial method of information transfer over the Internet or electronic data storage is known to be 100% secure. As a result, we cannot guarantee the absolute security of that information during its transmission or its storage in our systems.","Generic"
"23","7. Privacy and Third-Party Links This Privacy Policy applies solely to information collected by our Site. In an attempt to provide you with increased value, we may include third-party links on our Site. These linked sites have separate and independent privacy policies. We therefore have no responsibility or liability for the content and activities of these linked sites. Nonetheless, we seek to protect the integrity of our Site and welcome any feedback about these linked sites (including if a specific link does not work).","Generic"
