"12","Each Service Provider must agree to implement and maintain reasonable security procedures and practices appropriate to the nature of your information in order to protect your personal information from unauthorized access, destruction, use, modification, or disclosure.","Generic"
"12","Each Service Provider must agree to implement and maintain reasonable security procedures and practices appropriate to the nature of your information in order to protect your personal information from unauthorized access, destruction, use, modification, or disclosure.","Privacy/Security program"
"12","Each Service Provider must agree to implement and maintain reasonable security procedures and practices appropriate to the nature of your information in order to protect your personal information from unauthorized access, destruction, use, modification, or disclosure.","Secure data storage"
"15","encryption","Secure data transfer"
"15","As a result, while we strive to protect personal information, we cannot and do not guarantee or warrant the security of any information you transmit to or from the Site, and you do so at your own risk.","Generic"
"15","We use encryption and authentication tools to protect the security of personal information that you share with us. However, no data transmission over the Internet (or, with respect to our mobile services, over cellular phone networks) can be guaranteed to be 100% secure. As a result, while we strive to protect personal information, we cannot and do not guarantee or warrant the security of any information you transmit to or from the Site, and you do so at your own risk.","Generic"
"15","We use encryption and authentication tools to protect the security of personal information that you share with us. However, no data transmission over the Internet (or, with respect to our mobile services, over cellular phone networks) can be guaranteed to be 100% secure. As a result, while we strive to protect personal information, we cannot and do not guarantee or warrant the security of any information you transmit to or from the Site, and you do so at your own risk.","Generic"
