"11","We also have partnered with Authorize.net, one of the most reputable and experienced credit card payment companies in the World to handle our users' online transactions.","Secure data transfer"
"11","we encrypt all information that you submit in ordering of our premium products using the Secure Sockets Layer (SSL) protocol","Secure data storage"
"11","In order to try to minimize this risk, we encrypt all information that you submit in ordering of our premium products using the Secure Sockets Layer (SSL) protocol.","Secure data transfer"
"11","We consider the protection of all personally identifiable information we receive from our Web site visitors and subscribers as critical to our corporate mission. Please be assured that we have security measures in place to protect against the loss and misuse of any information we receive from you. As with any transmission over the Internet, however, there is always some element of risk involved in sending personal information.","Generic"
"11","We also have partnered with Authorize.net, one of the most reputable and experienced credit card payment companies in the World to handle our users' online transactions.","Other"
"11","we have security measures in place to protect against the loss and misuse of any information we receive from you.","Generic"
"11","we encrypt all information that you submit in ordering of our premium products using the Secure Sockets Layer (SSL) protocol.","Secure data transfer"
"11","We also have partnered with Authorize.net, one of the most reputable and experienced credit card payment companies in the World to handle our users' online transactions.","Other"
