"20","To prevent unauthorized access, maintain data accuracy and ensure the appropriate use of information, we have put in place commercially reasonable physical, technical and administrative controls to protect your information.","Generic"
"0","we take your privacy very seriously, and make every effort to safeguard your personal data.","Generic"
"20","To prevent unauthorized access, maintain data accuracy and ensure the appropriate use of information, we have put in place commercially reasonable physical, technical and administrative controls to protect your information. Please note that no method of transmission over the internet is 100% secure.","Generic"
"5","This information will only be shared with third parties who perform tasks required to complete the purchase transaction.","Data access limitation"
"16","These third parties have access to your information only to perform these tasks on our behalf.","Data access limitation"
"20","we have put in place commercially reasonable physical, technical and administrative controls to protect your information.","Generic"
