"22","Email addresses collected from consumers during the use of the E-Cards or ""Send-to-a-Friend"" email feature on our websites are not retained by us, and are only used to send a one-time email notification on a consumer's behalf.","Perform service"
"40","for the period necessary to fulfill the purposes outlined in this policy","Perform service"
"40","necessary to fulfill the purposes outlined in this policy","Unspecified"
"18","promotional purpose through one of our websites","Marketing"
"18","or to make a purchase from the PlayStation Shop","Perform service"
"24","so that we may assist these customers with current or future service issues.","Perform service"
"40","necessary to fulfill the purposes outlined in this policy","Other"
