"2","excluding their personal information from the directory","Use"
"2","requested by vendors through the Texas Public Information Act. Students have the option of excluding their personal information from the directory during registration.","Third party sharing/collection"
"2","excluding their personal information from the directory","Collection"
"2","excluding their personal information from the directory","Collection"
"3","prohibits the release of education records","Third party sharing/collection"
"3","the release of education records","Third party sharing/collection"
