"1","Last updated: March 3, 2014. To see what has changed, click here.","Unspecified"
"1","click here.","Unspecified"
"14","substantially all of its assets are acquired","In case of merger or acquisition"
"29","Privacy Notice","Privacy relevant change"
"29","Privacy Notice","Privacy relevant change"
"1","To see what has changed, click here.","Unspecified"
"1","To see what has changed, click here.","Unspecified"
"2","Use, Notices, and Revisions","Unspecified"
"22","uch as this Privacy Notice","Unspecified"
"29","our Privacy Notice and the Conditions of Use will change also.","Unspecified"
"29","this Notice and our Conditions of Use,","Unspecified"
