"4","This privacy policy may be modified from time to time. If we decide to change our privacy policy","Unspecified"
"4","If we decide to change our privacy policy,","Privacy relevant change"
"41","If, at anytime in the future, Tulsaworld.com decides to use information provided by you in a way not described here,","Privacy relevant change"
"4","those changes","Unspecified"
"4","those changes","Unspecified"
"41","If, at anytime in the future, Tulsaworld.com decides to use information provided by you in a way not described here,","Privacy relevant change"
