"52","changes substantially alter your rights","Privacy relevant change"
"52","minor changes","Non-privacy relevant change"
"52","Where the changes substantially alter your rights,","Privacy relevant change"
"52","More minor changes","Non-privacy relevant change"
"52","We reserve the right to change this policy to meet the changing needs of reddit, or for any other reason. If we make changes, we will notify our users. Where the changes substantially alter your rights, notice will appear prominently on your front page.","Privacy relevant change"
"52","We reserve the right to change this policy to meet the changing needs of reddit, or for any other reason. If we make changes, we will notify our users. Where the changes substantially alter your rights, notice will appear prominently on your front page.","Privacy relevant change"
