"4","When you place an order with us online, in a store or in any other way,","Other"
"13","we note that you are a subscriber","User with account"
"13","we note that you are a subscriber","User with account"
"24","If you sign up as an affiliate","User with account"
"33","If you have purchased from us or created an account,","User with account"
"33","created an account,","User with account"
"33","created an account","User with account"
"33","If you have purchased from us","Unspecified"
"34","have a registered account","User with account"
