"0","Sci-News.com is committed to protecting and respecting your privacy. To better inform you of our policy concerning user privacy, we have adopted the following terms. Please note that these terms are subject to change, and any such changes will be included on this page.","Introductory/Generic"
"4","Parents or guardians may contact us at privacy@sci-news.com with questions or concerns about our privacy policy.","Privacy contact information"
"6","During the course of any visit to the Sci-News.com website, the pages you see, along with a cookie, are downloaded to your device. A website does this because cookies enable a publisher to find out whether the device has visited the website before. This is done on a repeat visit by checking to see, and finding, the cookie left there on the last visit.","Practice not covered"
"7","Please note that during or after your visits to the Sci-News.com website you may notice some cookies that are not related to it. Sci-News.com does not control the dissemination of these cookies. You must check the third party websites for more information about these.","Practice not covered"
"11","contact us with your request at privacy@sci-news.com.","Privacy contact information"
"12","Contact Us If you have any inquiries about this Privacy Policy or its implementation, you may contact us at privacy@sci-news.com.","Privacy contact information"
"0","Sci-News.com is committed to protecting and respecting your privacy. To better inform you of our policy concerning user privacy, we have adopted the following terms. Please note that these terms are subject to change, and any such changes will be included on this page.","Introductory/Generic"
"10","By using Sci-News.com, you consent to the collection and use, in accordance with this policy, of the information you provide to us.","Introductory/Generic"
"12","If you have any inquiries about this Privacy Policy or its implementation, you may contact us at privacy@sci-news.com.","Privacy contact information"
"0","Sci-News.com is committed to protecting and respecting your privacy. To better inform you of our policy concerning user privacy, we have adopted the following terms.","Introductory/Generic"
"4","Parents or guardians may contact us at privacy@sci-news.com with questions or concerns about our privacy policy.","Privacy contact information"
"10","By using Sci-News.com, you consent to the collection and use, in accordance with this policy, of the information you provide to us.","Other"
"11","privacy@sci-news.com.","Privacy contact information"
"12","privacy@sci-news.com.","Privacy contact information"
