"0","This privacy policy applies to the www.citizen.org website.","Introductory/Generic"
"2","They will not retain the information or contact the people whose information they have access to.","Practice not covered"
"4","they will not retain the information or contact the people whose information they have access to. To stop receiving emails, complete the form at http://action.citizen.org/unsubscribe.jsp.","Practice not covered"
"13","If you have questions about this privacy policy, contact our Member Services team at (800) 289-3787 or member@citizen.org.","Privacy contact information"
"13","If you have questions about this privacy policy, contact our Member Services team at (800) 289-3787 or member@citizen.org.","Privacy contact information"
"12","Updates to This Policy","Introductory/Generic"
"13","questions about this privacy policy, contact","Privacy contact information"
