"0","The following Privacy Policy summarizes the various ways we treat personally identifiable and other information about you and your computer, mobile or other device when you access, visit and/or use the Service. This Privacy Policy does not cover information collected elsewhere, including without limitation offline and on sites, applications, destinations, or services linked to from the Service.","Introductory/Generic"
"0","The following Privacy Policy summarizes the various ways we treat personally identifiable and other information about you and your computer, mobile or other device when you access, visit and/or use the Service. This Privacy Policy does not cover information collected elsewhere, including without limitation offline and on sites, applications, destinations, or services linked to from the Service.","Introductory/Generic"
"0","The following Privacy Policy summarizes the various ways we treat personally identifiable and other information about you and your computer, mobile or other device when you access, visit and/or use the Service. This Privacy Policy does not cover information collected elsewhere, including without limitation offline and on sites, applications, destinations, or services linked to from the Service.","Introductory/Generic"
"6","While we may seek to require such third parties to follow appropriate privacy policies and will not authorize them to use this information except for the express purpose for which it is provided, we do not bear any responsibility for any actions or policies of third parties.","Practice not covered"
"12","We reserve the right to identify you from your Registration Information and/or to merge or co-mingle anonymous or non-personally identifiable data about you, your offline and online behavior, and/or your computer, mobile or other device (including its geographic location), with your Registration Information and/or other personally identifiable data for any lawful business purpose.","Practice not covered"
"17","The use of Tracking Technologies by third parties is subject to their own privacy policies, not this Privacy Policy, and we have no responsibility or liability in connection therewith.","Practice not covered"
"18","Your information may be transferred to, and maintained on, servers and databases located outside of your state, province, country or other governmental jurisdiction where the privacy laws may not be as protective as your jurisdiction. Please be advised that we may transfer your information to and from any state, province, country or other governmental jurisdiction, and process it in the United States or elsewhere. Your consent to this Privacy Policy followed by your submission of such information represents your agreement to any such transfer.","Other"
"19","we are not responsible for any loss of such information or the consequences thereof.","Practice not covered"
"20","Moreover, if you elect to store information, such as your personally identifiable information or other Registration Information, where others may access it, we are not responsible for any loss of such information or the consequences thereof. If you lose a computer, mobile or other device, or it is stolen, that contains your personally identifiable information or other Registration Information, it is up to you to take all the steps necessary to protect yourself.","Introductory/Generic"
"26","contact","Privacy contact information"
"26","you have any concerns or questions about any aspect of this policy, please feel free to contact our Privacy Policy Coordinator as follows: Privacy Policy Coordinator Cond Nast 1313 Market Street Wilmington, DE 19801 Privacy_administration@condenast.com","Privacy contact information"
"26","Privacy Policy Coordinator Cond Nast 1313 Market Street Wilmington, DE 19801 Privacy_administration@condenast.com","Privacy contact information"
"30","If you don't agree to the terms contained in this User Agreement and Privacy Policy, you must immediately exit the Service.","Practice not covered"
