"0","Liquor.com Holdings, Inc. (""Liquor.com"") takes very seriously the private nature of your personal information. It is the goal of Liquor.com to bring you information that is relevant and targeted to your individual needs and, at the same time, protect your privacy. This Privacy Policy describes how we treat the information we collect when you visit our Web site and/or register for our email publication. Please read this notice carefully.","Introductory/Generic"
"10","LINKS TO OTHER SITES As part of the service, Liquor.com may create links allowing you to access third party sites. Liquor.com is not responsible for the content that appears on those sites and does not endorse these sites. Please consult those sites' individual privacy policies in order to determine how they treat user information.","Practice not covered"
"0","Liquor.com Holdings, Inc. (""Liquor.com"") takes very seriously the private nature of your personal information. It is the goal of Liquor.com to bring you information that is relevant and targeted to your individual needs and, at the same time, protect your privacy. This Privacy Policy describes how we treat the information we collect when you visit our Web site and/or register for our email publication. Please read this notice carefully.","Introductory/Generic"
"12","Thank you for taking the time and interest to review our policies at Liquor.com. If you have concerns or questions about any aspect of the Liquor.com Privacy Policy, please contact us. We welcome your questions and feedback. Please send all emails to: info@liquor.com.","Privacy contact information"
"0","Liquor.com Holdings, Inc. (""Liquor.com"") takes very seriously the private nature of your personal information. It is the goal of Liquor.com to bring you information that is relevant and targeted to your individual needs and, at the same time, protect your privacy. This Privacy Policy describes how we treat the information we collect when you visit our Web site and/or register for our email publication. Please read this notice carefully.","Introductory/Generic"
"7","we do not have control over cookies placed by advertisers.","Practice not covered"
"10","Liquor.com may create links allowing you to access third party sites. Liquor.com is not responsible for the content that appears on those sites and does not endorse these sites. Please consult those sites' individual privacy policies","Other"
"12","If you have concerns or questions about any aspect of the Liquor.com Privacy Policy, please contact us. We welcome your questions and feedback. Please send all emails to: info@liquor.com.","Privacy contact information"
