"0","We respect your right to privacy and will protect it. Any information you provide is strictly confidential and solely for our company use. No information will be sold to any other companies or organizations.","Introductory/Generic"
"4","Our phone number is 707 887 1507.","Privacy contact information"
"0","Privacy Policy We respect your right to privacy and will protect it. Any information you provide is strictly confidential and solely for our company use. No information will be sold to any other companies or organizations.","Introductory/Generic"
"1","These targeted advertisements may appear on other websites that you visit.","Practice not covered"
"3","Our advertising partner will make the data that we provide anonymous so that no one else will receive your PII.","Practice not covered"
"4","Our phone number is 707 887 1507.","Privacy contact information"
"5","If you delete your Cookies, use a different browser, or buy a new computer, you will need to renew your opt-out choice.","Practice not covered"
