"2","Last Updated: March 1, 2015","Unspecified"
"38","You will be notified via e-mail of any such change in ownership or control of your personal information. For more information see the ""Changes in Our Privacy Policy"" section below.","Unspecified"
"42","Also, we may ask registered users and members to review and consent to the changes at the time of their next account log-in. By continuing to use the JibJab Site(s) affected by such changes after such notice and consent, you agree to be bound by the changes to this Privacy Policy.","Other"
"42","Also, we may ask registered users and members to review and consent to the changes at the time of their next account log-in. By continuing to use the JibJab Site(s) affected by such changes after such notice and consent, you agree to be bound by the changes to this Privacy Policy.","Other"
"42","This Privacy Policy is subject to change by JibJab from time to time.","Unspecified"
"42","By continuing to use the JibJab Site(s) affected by such changes after such notice and consent, you agree to be bound by the changes to this Privacy Policy","None"
"42","consent to the changes","Opt-in"
"42","consent to the changes","Opt-in"
