"36","we will post those changes to this privacy statement,","General notice in privacy policy"
"24","Users will be notified via email prior to a change of ownership or control of their personal information. If as a result of the business transition, the users? personally identifiable information will be used in a manner different from that stated at the time of collection they will be given choice consistent with our notification of changes section.","Unspecified"
"36","we will post those changes to this privacy statement","General notice in privacy policy"
"36","the homepage,","General notice on website"
"36","the homepage,","General notice on website"
"37","we will notify users via email.","Personal notice"
"37","we will post a prominent notice on our Web site notifying users of the change.","General notice on website"
"36","we will post those changes to this privacy statement, the homepage, and other places we deem appropriate","General notice on website"
"37","notify users via email","Personal notice"
