"30","sending a notice to the primary email address specified in your Yahoo account","Personal notice"
"30","by placing a prominent notice on our site.","General notice on website"
"30","We will notify you about significant changes in the way we treat personal information by sending a notice to the primary email address specified in your Yahoo account","Personal notice"
"30","or by placing a prominent notice on our site.","General notice on website"
"33","Last Updated: September 25, 2014","General notice in privacy policy"
"30","sending a notice to the primary email address","Personal notice"
