"4","y, we will post those changes to this privacy policy and other places we deem appropriate.","General notice in privacy policy"
"4","we will post those changes to this privacy policy and other places we deem appropriate.","General notice in privacy policy"
"41","we will contact you beforehand to explain the use of the information","Personal notice"
"4","we will post those changes to this privacy policy","General notice in privacy policy"
"4","other places we deem appropriate","Unspecified"
"41","we will contact you beforehand to explain the use of the information","Personal notice"
