"60","We will post the date our Policy was last updated at the top of the Privacy Policy.","Unspecified"
"60","additional notice of significant updates.","Unspecified"
"60","We will post the date our Policy was last updated at the top of the Privacy Policy.","General notice in privacy policy"
"60","We will post the date our Policy was last updated at the top of the Privacy Policy.","General notice in privacy policy"
"61","We will provide additional notice of significant updates","Unspecified"
"61","We will post the date our Policy was last updated at the top of the Privacy Policy.","General notice in privacy policy"
