"29","no longer than is necessary for the purposes for which the data was collected","Limited"
"29","Unless there is a specific legal requirement","Unspecified"
"29","e will retain it for no longer than is necessary","Limited"
"29","e will retain it for no longer than is necessary","Limited"
"29","egal requirements to keep data for a minimum period.","Limited"
"29","The time period for which we keep information varies according to the purpose for which it is used for. In some cases, there are legal requirements to keep data for a minimum period. Unless there is a specific legal requirement for us to keep the information, we will retain it for no longer than is necessary for the purposes for which the data was collected or for which it is to be further processed.","Unspecified"
