"2","Safe Harbor Program","Europeans"
"25","Amazon.com does not sell products for purchase by children. We sell children's products for purchase by adults. If you are under 18, you may use Amazon.com only with the involvement of a parent or guardian.","Children"
"26","Amazon.com is a participant in the Safe Harbor program developed by the U.S. Department of Commerce and (1) the European Union and (2) Switzerland, respectively.","Europeans"
"27","n compliance with the US-EU and US-Swiss Safe Harbor Principles","Europeans"
"28","Under the Safe Harbor program,","Europeans"
"25","does not sell products for purchase by children. We sell children's products for purchase by adults. If you are under 18, you may use Amazon.com only with the involvement of a parent or guardian","Children"
