"7","entity (such as a corporation, partnership or limited liability company) or an educational institution","Other"
"26","10. Your California Privacy Rights Under California's ""Shine the Light"" law, California residents who provide personal information in obtaining products or services for personal, family or household use are entitled to request and obtain from us, once per calendar year, information about the customer information we shared, if any, with other businesses for their own direct marketing uses. If applicable, this information would include the categories of customer information and the names and addresses of those businesses with which we shared customer information for the immediately prior calendar year (e.g. requests made in 2013 will receive information regarding 2012 sharing activities).","Californians"
"26","Your California Privacy Rights Under California's ""Shine the Light"" law, California residents who provide personal information in obtaining products or services for personal, family or household use are entitled to request and obtain from us, once per calendar year, information about the customer information we shared, if any, with other businesses for their own direct marketing uses. If applicable, this information would include the categories of customer information and the names and addresses of those businesses with which we shared customer information for the immediately prior calendar year (e.g. requests made in 2013 will receive information regarding 2012 sharing activities).","Californians"
"26","California Privacy Rights","Californians"
"27","To obtain this information from the Post-Gazette, please send an email message to webmaster@post-gazette.com with ""Request for California Privacy Information"" on the subject line and in the body of your message. We will provide the requested information to you at your e-mail address in response. Not all information sharing is covered by the ""Shine the Light"" requirements and only information on covered sharing will be included in our response.","Californians"
"27","To obtain this information from the Post-Gazette, please send an email message to webmaster@post-gazette.com with ""Request for California Privacy Information"" on the subject line and in the body of your message. We will provide the requested information to you at your e-mail address in response. Not all information sharing is covered by the ""Shine the Light"" requirements and only information on covered sharing will be included in our response.","Californians"
"27","California Privacy Information","Californians"
