"2","Everyone who submits personal information to Zacks Investment Research online","Collect on website"
"3","During the Zacks.com registration process,","Collect on website"
"4","Everyone who submits personal postal and phone number information to Zacks Investment Research online","Collect on website"
"4","submits personal postal and phone number information to Zacks Investment Research online","Collect on website"
"5","We collect","Unspecified"
"7","If you decide to subscribe to any of our paid newsletters, we collect","Collect on website"
"8","Cookies: Zacks Investment Research uses","Other"
"1","on our Zacks.com Web site","Collect on website"
"3","Zacks.com","Collect on website"
